{"algorithm":"internal-current-tree-offline-source-v3","commitment_sha256":"76a224ad262a678f181b2492f0cf7ad64c9104df41cb9ecdbb6e802db57648dc","files":[{"bytes":2168,"path":".gitattributes","sha256":"f93953a1a73a530387ca3e01127b0d98864550ecd47c8b4fafc3722f81066d40"},{"bytes":4268,"path":".github/workflows/item6-controlled-comparison.yml","sha256":"56b1476ef981989ef030a1a31cad7237f4e694ba7adbc7e14e4739fae7039d5e"},{"bytes":5549,"path":"evals/internal_behavior_eval_v1/CONTRACT.md","sha256":"9c623cc4ddc5448f7ea7a41c013d64769b2c482e21c199c611acf25156275259"},{"bytes":15753,"path":"evals/internal_behavior_eval_v1/PUBLIC_DERIVATION_PROVENANCE_v1.json","sha256":"664bd9fd2b8936c57b4bc28bb57e19a2b86409e80f195954d18277f3c91a84ef"},{"bytes":1879,"path":"evals/internal_behavior_eval_v1/PUBLIC_HANDOFF_DERIVATION_PROVENANCE_v1.json","sha256":"13f8210ea41efe74a5b1126d8f8b48e685302c3b1a6cb5f2f45460232cf8f7d9"},{"bytes":10376,"path":"evals/internal_behavior_eval_v1/example-plan.json","sha256":"cf4074231804acdf97206c7778a31ec3de8fb636ee443a8ba4cc8de521d805b0"},{"bytes":13402,"path":"evals/internal_behavior_eval_v1/example-report.json","sha256":"92e8e360fb2c0c7d08d80bb3e8cc238ee0d6c4bdc2df81de7ed5bf2b594f4a26"},{"bytes":22948,"path":"evals/internal_behavior_eval_v1/repair_p1/null-review.json","sha256":"f5983b2030d88ce91d3a902bdf8fa52bc18739e7e393f382b55b0027ed783661"},{"bytes":1630,"path":"evals/internal_behavior_eval_v1/repair_p1/pre-repair-files.json","sha256":"11e33052b38c430439f0f40fa595f5a1958b5fb9ac221a9d4656c874e0c5c984"},{"bytes":4152,"path":"evals/internal_behavior_eval_v1/repair_p1/review.json","sha256":"3d66db8cc1b17c49f3e2c4e763f4a73e5ca8741f41af7e8c2274989e446939c1"},{"bytes":17373,"path":"evals/internal_behavior_eval_v1/repair_p1/validation-full.json","sha256":"fcda3bfc46438f94b89d76e0bf3ada16e8d0c3ba1418662859d63eb3131f7037"},{"bytes":6188,"path":"evals/internal_behavior_eval_v1/repair_p1/validation-green.json","sha256":"bfdcb9dadfc48e5dfdd37662a25a3697d97a149f5cb450a3e66bbbb23f9927dd"},{"bytes":14968,"path":"evals/internal_behavior_eval_v1/repair_p1/validation-red.public-redacted-v1.json","sha256":"34d513698f9cb7f33d4d47c7b1982995a4b70a9f1369613f9f19f61452f17fcf"},{"bytes":3310,"path":"evals/internal_behavior_eval_v1/repair_p1/verify.py","sha256":"bbd442fedd35e335ea4aa2bb3225da8502acf45b8cb1e0f435d08923dc201686"},{"bytes":38073,"path":"evals/internal_behavior_eval_v1/scorer_cases.json","sha256":"b990480b75d633614e966271c28d4971dd82f29418772500ce227d0fff90a0c0"},{"bytes":3921,"path":"evals/internal_behavior_eval_v1/text_observation_v1_1/REVISION.md","sha256":"cdd8d3cb95b859a5a3738dc24e5f2b63bdfb81516e7f20d99eceff8cd184fc15"},{"bytes":19998,"path":"evals/internal_behavior_eval_v1/text_observation_v1_1/example-plan.json","sha256":"d083ed36385699cdc7ebaad558fb4890802fff9569acaa1c5a8b782e43c23f08"},{"bytes":22908,"path":"evals/internal_behavior_eval_v1/text_observation_v1_1/example-report.json","sha256":"af6d6f655bb306682809c1abe52ef2b7e04c2db2d40fadfa59c0d9f8a9a6d7dc"},{"bytes":2958,"path":"evals/internal_behavior_eval_v1/text_observation_v1_1/pre-revision-files.json","sha256":"cdb0b7496e9fa4e809e2d40aaa29cbef8e3c0e3396ead5b2a5f67c227f28da10"},{"bytes":5643,"path":"evals/internal_behavior_eval_v1/text_observation_v1_1/review.json","sha256":"d174f1fe196577bc169576d1accc290a6a5f0570f3381021b774ce93ae8284f6"},{"bytes":48478,"path":"evals/internal_behavior_eval_v1/text_observation_v1_1/validation-before-implementation.public-redacted-v1.json","sha256":"c9c590573fae4bdb8ce9c0f7e2ec75b97e76b1937f82947cf98276fb6236044b"},{"bytes":22817,"path":"evals/internal_behavior_eval_v1/text_observation_v1_1/validation-full.json","sha256":"3df3bc837a18865897e2c83b294fe52a644da2a17e4f79d91a4144d475128eeb"},{"bytes":7165,"path":"evals/internal_behavior_eval_v1/text_observation_v1_1/validation-regression.json","sha256":"1869926b42aeacf5438887d7160589a837443547e4c08a889978b73aa8d0323a"},{"bytes":4245,"path":"evals/internal_behavior_eval_v1/text_observation_v1_1/validation-related.json","sha256":"5a3025eed5ea8b8ae4f3de02d88634cf221e59b57c5b6f265de4073e5812d52d"},{"bytes":4384,"path":"evals/internal_behavior_eval_v1/text_observation_v1_1/verify.py","sha256":"ee034fca18bcf2ad6e08643a6f0ffe5a911751eb65ac462153d7beb8dfa08477"},{"bytes":330,"path":"evals/internal_behavior_eval_v1/validation-delivery.json","sha256":"75ca3b87dc07df5bae373ce23eb77ca87c073b586451c646077e708e32d1fa07"},{"bytes":330,"path":"evals/internal_behavior_eval_v1/validation-final.json","sha256":"75ca3b87dc07df5bae373ce23eb77ca87c073b586451c646077e708e32d1fa07"},{"bytes":330,"path":"evals/internal_behavior_eval_v1/validation-initial.json","sha256":"b3e39d92d5bb42cf6563ff10d5d6a85e17b60a80f8af0bb29b4623ca8348e774"},{"bytes":3784,"path":"evals/item6_experiment_bridge_v1/BUSINESS_PRIVACY_RULES_V2.md","sha256":"60dc52532cf28641dcf7a1adaf230ae1abe50fe2c1e3411ba4dda4e95a84f9ff"},{"bytes":10071,"path":"evals/item6_experiment_bridge_v1/CASE_REJECTION_ISOLATION_V1.md","sha256":"a1ecd73386521fee09f49353fa93c16ef2994422112bcc31c3c372f509637485"},{"bytes":4816,"path":"evals/item6_experiment_bridge_v1/CASE_REJECTION_ISOLATION_V1_1.md","sha256":"6e8566e44ea9854bcb6a92b26d760d6a7c121e3f708586cf4ebd5c7616f05ea9"},{"bytes":11992,"path":"evals/item6_experiment_bridge_v1/CONTRACT.md","sha256":"2772bcc806a0c75b3235781b5b0fb3345205dd6ce21f09804a7c9d6a5b3aff1b"},{"bytes":4573,"path":"evals/item6_experiment_bridge_v1/PRIVACY_DIAGNOSTICS_V1.md","sha256":"099a5af159534b71d2a342b007ea58164f1d5a1d69ba073e50888266f2f857b6"},{"bytes":3258,"path":"evals/item6_experiment_bridge_v1/TASK_INTERFACE_V2.md","sha256":"2008803857fe31356a8ee5c6346fc109576b1d87c11fe820303076218e311b3e"},{"bytes":2104,"path":"evals/item6_experiment_bridge_v1/approval.schema.json","sha256":"5ef70ac43b26c4c6dd95d423a98a4bf1bb48372d89945f3e48598ff44f52679f"},{"bytes":20244,"path":"evals/item6_experiment_bridge_v1/artifact.schema.json","sha256":"50406baf989588cee869f4f483800d53ac0d6083f156e27119fbb68d3167bf2e"},{"bytes":57542,"path":"evals/item6_experiment_bridge_v1/artifact_v1_2.schema.json","sha256":"8acfd57f60f74b4aa15a333d604be4ddf38b10da5784e258b299d081e68cdc10"},{"bytes":57630,"path":"evals/item6_experiment_bridge_v1/artifact_v1_3.schema.json","sha256":"6d8c5c0bac3f6e1865c5a5a1dfe90b5d7981b38f696169dfd45ec7f0a9ccac85"},{"bytes":64766,"path":"evals/item6_experiment_bridge_v1/artifact_v1_4.schema.json","sha256":"5cb3286941248a1c2d73821a3692fb37ddb661c13fd28634dca2fa1c449f8232"},{"bytes":64766,"path":"evals/item6_experiment_bridge_v1/artifact_v1_5.schema.json","sha256":"0558fe0a6bc426eca69a0c17883089a1eb3f6a0cf4d4a71ff9a72541e2d16039"},{"bytes":64766,"path":"evals/item6_experiment_bridge_v1/artifact_v1_6.schema.json","sha256":"4a32199dadc0849da644d397830616796f8672d6c7878e0992eb57d508edf20c"},{"bytes":537,"path":"evals/item6_experiment_bridge_v1/case_rejection_policy_v1.json","sha256":"e4f2af19debe5c69ce1976c1e828f5feb4a6f5c161985b687ab197baeb83826d"},{"bytes":533,"path":"evals/item6_experiment_bridge_v1/case_rejection_policy_v1_1.json","sha256":"8f11abe53dc8788bc608239fbed6ef66aa6905496aa6b810551665714e874565"},{"bytes":10292,"path":"evals/item6_experiment_bridge_v1/freeze.schema.json","sha256":"95da0f873e642b0bb4d2e8cdde52468b27e1681c0520f4a8f0c449205bfbf754"},{"bytes":10578,"path":"evals/item6_experiment_bridge_v1/freeze_v1_1.schema.json","sha256":"b01c3a978cbebbbced778db1b7d05fcb33d08a184cd70db175c3fbeb93356290"},{"bytes":10578,"path":"evals/item6_experiment_bridge_v1/freeze_v1_2.schema.json","sha256":"63d88401282dfbfcb88c5d920069bc7e081cc0cf033e238ee57fbe93771e0b0c"},{"bytes":10578,"path":"evals/item6_experiment_bridge_v1/freeze_v1_3.schema.json","sha256":"f9005aebfe84556aa2f97fca4de5dfa8c6d09094245b7b45d0c2dca61913f672"},{"bytes":2077,"path":"evals/item6_experiment_bridge_v1/policy_v1.json","sha256":"29fb24c4671d33dfb5a4597eb5b01690491d5c7a03546821599b7ee70856ca08"},{"bytes":2077,"path":"evals/item6_experiment_bridge_v1/policy_v2.json","sha256":"ac99db8b29b3e916f8ae4b30e53a55df96121f6fb0897be0a1473c8a479e9896"},{"bytes":69499,"path":"evals/phase6_agent_tasks.jsonl","sha256":"af945e5bd780b39e7639102dab75c446350a81e9e9464fe156e41d2a45cebc2c"},{"bytes":5398,"path":"evals/phase6_deepseek_depth60_plan.json","sha256":"f5d43283e3506663383359d24736bd3b82a910e45cc092954f94d86a80e6cd20"},{"bytes":2149,"path":"evals/phase6_deepseek_depth60_plan_v11.json","sha256":"13892cb977af1366e25c4cee586ce2dd98bd2ed3acffd8b8c0c5b5beb739383f"},{"bytes":2170,"path":"evals/phase6_deepseek_depth60_plan_v2.json","sha256":"fc4ca5cc2131efb36d82f1d739f65ad2a026e1c7534f0da9c873942a40c1002f"},{"bytes":2850,"path":"evals/phase6_deepseek_depth60_plan_v3.json","sha256":"5602f940a8627b9c785a1b785d757119a616050ebbc2e31e9dd26aacf448c05e"},{"bytes":3087,"path":"evals/phase6_deepseek_depth60_plan_v4.json","sha256":"ae961e069afa9c842c294f7fb6951e0cf3a4ad86dfcdd16cb96a2c264c232956"},{"bytes":3120,"path":"evals/phase6_deepseek_depth60_plan_v5.json","sha256":"ff39dd5a1aa09b7bc92b27f9d800b5d51fbd2fd69c2a599b5bf0f25aed490aae"},{"bytes":1801,"path":"evals/phase6_deepseek_depth60_plan_v6.json","sha256":"bed517817d7c65e2920939836521aa055c9c8571359da7c25bc1cc05cc2f27ee"},{"bytes":2147,"path":"evals/phase6_deepseek_depth60_plan_v7.json","sha256":"396b2103399af1a68854f1f61abd5547f841a68edde78702fbba4df2910806c1"},{"bytes":2033,"path":"evals/phase6_splits.json","sha256":"777256c08d78f8f84f0c56ee86d9f8f669add75717148e9e4b5ae27da6820a0f"},{"bytes":6831,"path":"evals/provider_completion_admission_link_v1/admission_link_contract_v1.json","sha256":"94c23d0f64593d2fb52adcffd2d0decf531f2e78907d0e0b4cd85573c2b60561"},{"bytes":5309,"path":"evals/provider_completion_admission_link_v1/first_live_artifact_profile_v1.json","sha256":"573a3294662f28556585af225929e6b5a8f7cbae64b2e7eeb0429457a3ef7af0"},{"bytes":1886,"path":"evals/provider_completion_admission_link_v1/schemas/external_review_observation_v1.schema.json","sha256":"aa490e4141a100936ec181c757de2d9aa81d22e9252de7ddadf0831d79c3814a"},{"byt